{
  "schema_version": 1,
  "device_id": "2c1f2d8e-2bb7-4f58-bb6a-6c2a0f4a7a4c",
  "event_ts": "2025-12-15T10:00:00Z",
  "received_ts": "2025-12-15T10:00:00.123Z",
  "seq": 12345,
  "metrics": {
    "displacement_mm": 1.23,
    "tilt_x_deg": 0.18,
    "battery_v": 3.92
  },
  "meta": {
    "fw": "1.0.0",
    "sampling_s": 5
  }
}
